{
  "$schema": "../schema/public-baseline.schema.json",
  "schema": "jqstar-public-baseline/1",
  "version": "0.1.0",
  "stability": "stable-for-0.x",
  "runtime": {
    "rootExports": [
      "SSEParser",
      "STAR_PLUGIN_API_VERSION",
      "StarDisposalError",
      "StarProtocolBodyOwnershipError",
      "StarProtocolSelectionError",
      "StarProtocolValidationError",
      "StarRenderTransactionError",
      "StarRequestMiddlewareNextError",
      "StarRequestMiddlewareValidationError",
      "cancelElementRequests",
      "cancelRequests",
      "clearExpressionCache",
      "compileStatement",
      "compileValue",
      "createBackendAction",
      "createRenderAdapter",
      "createTrustedExpressionEngine",
      "dynamicBackendAction",
      "executeBackendRequest",
      "installStar",
      "installStarCore",
      "nextUpdate",
      "parseSSE",
      "patchElements",
      "patchSignals",
      "sseDataFields"
    ],
    "typeExports": [
      "BackendActionOptions",
      "BackendMethod",
      "CalendarDate",
      "CalendarTarget",
      "CarouselTarget",
      "ChartData",
      "ChartSeries",
      "ChartTarget",
      "ChartType",
      "ClipboardState",
      "ClipboardTarget",
      "CodeBlockTarget",
      "ColorPickerTarget",
      "ComboboxTarget",
      "ComputedDefinition",
      "ComputedRecord",
      "ContextMenuTarget",
      "CountdownState",
      "CountdownTarget",
      "CountdownUntil",
      "DOMValue",
      "DataTableSort",
      "DataTableSortDirection",
      "DataTableTarget",
      "DatePickerTarget",
      "DateRangePickerTarget",
      "DialogOpenOptions",
      "DialogTarget",
      "DisclosureTarget",
      "EditableTarget",
      "EventBinding",
      "EventOptions",
      "FeedCompleteOptions",
      "FeedResetOptions",
      "FeedState",
      "FeedTarget",
      "FetchLifecycleDetail",
      "FileUploadTarget",
      "FormTarget",
      "HoverCardTarget",
      "InputOTPTarget",
      "JSONViewerTarget",
      "LogEntryInput",
      "LogFilter",
      "LogLevel",
      "LogViewerState",
      "LogViewerTarget",
      "MenuTarget",
      "MenubarTarget",
      "MessageScrollerLatestOptions",
      "MessageScrollerTarget",
      "ModelBinding",
      "MultiSelectTarget",
      "NumberFieldTarget",
      "PaginationTarget",
      "PasswordFieldTarget",
      "PatchElementsOptions",
      "PatchMode",
      "PatchNamespace",
      "PatchSignalsOptions",
      "PopoverTarget",
      "QuestionnaireAnswer",
      "QuestionnaireAnswers",
      "QuestionnaireTarget",
      "RangeCalendarTarget",
      "RangeCalendarValue",
      "RatingTarget",
      "RequestCancellation",
      "ResizableTarget",
      "RetryMode",
      "SSEMessage",
      "SearchFieldTarget",
      "SelectTarget",
      "SidebarTarget",
      "SignalFilter",
      "SortableTarget",
      "StarAction",
      "StarActionCancelledObservation",
      "StarActionCompletedObservation",
      "StarActionFailedObservation",
      "StarActionOperationObservation",
      "StarActionStartedObservation",
      "StarCalendarStatic",
      "StarCarouselStatic",
      "StarChartStatic",
      "StarClipboardStatic",
      "StarCodeBlockStatic",
      "StarColorPickerStatic",
      "StarComboboxStatic",
      "StarContext",
      "StarContextMenuStatic",
      "StarCoreInstallOptions",
      "StarCoreStatic",
      "StarCountdownStatic",
      "StarDataTableStatic",
      "StarDatePickerStatic",
      "StarDateRangePickerStatic",
      "StarDefinition",
      "StarDialogStatic",
      "StarDirective",
      "StarDirectiveAttribute",
      "StarDirectiveCleanup",
      "StarDirectiveContext",
      "StarDirectiveExactMatcher",
      "StarDirectiveMatcher",
      "StarDirectivePrefixMatcher",
      "StarDirectiveTask",
      "StarDisclosureStatic",
      "StarDisposalCategory",
      "StarDisposalFailure",
      "StarDisposalReport",
      "StarDisposalResource",
      "StarEditableStatic",
      "StarExpressionEngine",
      "StarExpressionError",
      "StarExpressionHelperScope",
      "StarExpressionLocation",
      "StarFeedStatic",
      "StarFileUploadStatic",
      "StarFormErrorOptions",
      "StarFormErrors",
      "StarFormStatic",
      "StarFormValidateOptions",
      "StarHoverCardStatic",
      "StarInputOTPStatic",
      "StarInstallOptions",
      "StarInstalledJQuery",
      "StarInstance",
      "StarJQueryMethod",
      "StarJSONViewerStatic",
      "StarLogViewerStatic",
      "StarMenuStatic",
      "StarMenubarStatic",
      "StarMessageScrollerStatic",
      "StarMultiSelectStatic",
      "StarNumberFieldStatic",
      "StarOperationCancellationReason",
      "StarOperationError",
      "StarOperationKind",
      "StarOperationObservation",
      "StarOperationObserver",
      "StarOperationObserverErrorHandler",
      "StarOperationOwner",
      "StarOperationSubscriptionOptions",
      "StarOperationTerminalPhase",
      "StarOperationUnsubscribe",
      "StarPaginationStatic",
      "StarParsedDirectiveAttribute",
      "StarPasswordFieldStatic",
      "StarPlugin",
      "StarPluginActivation",
      "StarPluginApplicationHook",
      "StarPluginCleanup",
      "StarPluginDocumentHost",
      "StarPluginFacade",
      "StarPluginRegistrar",
      "StarPluginResourceKind",
      "StarPopoverStatic",
      "StarProtocolBodyLease",
      "StarProtocolCompatibilityEvent",
      "StarProtocolEmptyResponseHandler",
      "StarProtocolExactMediaMatcher",
      "StarProtocolFormMetadata",
      "StarProtocolMediaMatcher",
      "StarProtocolProfileDefinition",
      "StarProtocolRequestInput",
      "StarProtocolRequestPreparer",
      "StarProtocolRequestWriter",
      "StarProtocolResponseAdapter",
      "StarProtocolResponseCapabilities",
      "StarProtocolResponseHandler",
      "StarProtocolResponseMetadata",
      "StarProtocolSerializedPayload",
      "StarProtocolStreamConsumer",
      "StarProtocolSuffixMediaMatcher",
      "StarQuestionnaireStatic",
      "StarRangeCalendarStatic",
      "StarRatingStatic",
      "StarRenderAdapter",
      "StarRenderBeginOptions",
      "StarRenderTransaction",
      "StarRequestBodyKind",
      "StarRequestBodyMetadata",
      "StarRequestCancelledObservation",
      "StarRequestCompletedObservation",
      "StarRequestDescriptor",
      "StarRequestFailedObservation",
      "StarRequestMiddleware",
      "StarRequestMiddlewareCancelledOutcome",
      "StarRequestMiddlewareCompletedOutcome",
      "StarRequestMiddlewareContext",
      "StarRequestMiddlewareDefinition",
      "StarRequestMiddlewareFailedOutcome",
      "StarRequestMiddlewareNext",
      "StarRequestMiddlewareOutcome",
      "StarRequestOperationMetadata",
      "StarRequestOperationObservation",
      "StarRequestProgressObservation",
      "StarRequestRetryingObservation",
      "StarRequestStartedObservation",
      "StarResizableStatic",
      "StarSearchFieldStatic",
      "StarSelectStatic",
      "StarSidebarStatic",
      "StarSortableStatic",
      "StarStatementEvaluator",
      "StarStatic",
      "StarStepperStatic",
      "StarStoreCancelledObservation",
      "StarStoreCompletedObservation",
      "StarStoreFailedObservation",
      "StarStoreOperationCategory",
      "StarStoreOperationMetadata",
      "StarStoreOperationObservation",
      "StarStoresScope",
      "StarTabsStatic",
      "StarTagsInputStatic",
      "StarTimePickerStatic",
      "StarToastStatic",
      "StarToggleGroupStatic",
      "StarToggleStatic",
      "StarToolbarStatic",
      "StarTooltipStatic",
      "StarTransferListStatic",
      "StarTreeStatic",
      "StarUIStatic",
      "StarValueEvaluator",
      "StateRecord",
      "StepperTarget",
      "TabTarget",
      "TabsTarget",
      "TagsInputTarget",
      "TimePickerTarget",
      "ToastOptions",
      "ToastPriority",
      "ToastTarget",
      "ToastVariant",
      "ToggleGroupTarget",
      "ToggleTarget",
      "ToolbarTarget",
      "TooltipTarget",
      "TransferListTarget",
      "TreeTarget",
      "UIRule",
      "Value"
    ],
    "jqueryInstanceMembers": ["star"],
    "jqueryStaticMembers": ["star"],
    "pluginCommands": ["destroy", "instance", "refresh", "state"],
    "starStaticMembers": [
      "action",
      "boot",
      "clearExpressionCache",
      "delete",
      "dispose",
      "get",
      "nextUpdate",
      "observeOperations",
      "patch",
      "post",
      "put",
      "ui",
      "use",
      "version",
      "whenEnhanced"
    ],
    "uiMembers": [
      "accordion",
      "calendar",
      "carousel",
      "chart",
      "clipboard",
      "codeBlock",
      "collapsible",
      "colorPicker",
      "combobox",
      "contextMenu",
      "countdown",
      "dataTable",
      "datePicker",
      "dateRangePicker",
      "dialog",
      "editable",
      "enhance",
      "feed",
      "fileUpload",
      "form",
      "hoverCard",
      "inputOTP",
      "jsonViewer",
      "logViewer",
      "menu",
      "menubar",
      "messageScroller",
      "multiSelect",
      "numberField",
      "pagination",
      "passwordField",
      "popover",
      "questionnaire",
      "rangeCalendar",
      "rating",
      "resizable",
      "searchField",
      "select",
      "sidebar",
      "sortable",
      "stepper",
      "tabs",
      "tagsInput",
      "timePicker",
      "toast",
      "toggle",
      "toggleGroup",
      "toolbar",
      "tooltip",
      "transferList",
      "tree"
    ],
    "registeredActions": [
      "delete",
      "get",
      "patch",
      "post",
      "put",
      "ui.accordion.close",
      "ui.accordion.open",
      "ui.accordion.toggle",
      "ui.calendar.next",
      "ui.calendar.previous",
      "ui.calendar.select",
      "ui.carousel.go",
      "ui.carousel.next",
      "ui.carousel.pause",
      "ui.carousel.play",
      "ui.carousel.previous",
      "ui.chart.refresh",
      "ui.chart.type",
      "ui.clipboard.copy",
      "ui.code-block.copy",